{
  "$schema": "../../../schemas/task-preset-plugin/commands.schema.json",
  "schemaVersion": "1.1",
  "selectionMode": "single",
  "groups": [
    {
      "id": "goal",
      "title": {
        "key": "commands.groups.goal"
      }
    }
  ],
  "commands": [
    {
      "id": "goal",
      "groupId": "goal",
      "label": "goal",
      "description": {
        "key": "commands.items.goal.description"
      },
      "preludeTemplate": "/goal {goalDescription}"
    }
  ]
}
